{
  "id": "codex",
  "label": "Codex",
  "nativeSlashCommands": true,
  "supportsSubagents": false,
  "status": "native-command-files",
  "pluginPath": ".codex-plugin/plugin.json",
  "ruleEntrypoints": ["AGENTS.md", ".codex/", ".agents/skills/"],
  "installPaths": ["AGENTS.md", ".codex/commands/", ".codex/hooks/", ".codex/agents/", ".codex/rules/", ".agents/skills/"]
}
